{
  "$schema": "../cases.schema.json",
  "schemaVersion": 3,
  "benchmark": "CosmoEdge 1.1 small-model capacity benchmark",
  "platformId": "rk3576",
  "platform": "RK3576",
  "scope": "release-platform",
  "evidenceDate": "2026-08-19",
  "caseCount": 15,
  "gates": {
    "minFpsRatio": 0.8,
    "maxMissingRate": 0,
    "maxAverageDiscardRate": 0.05,
    "maxCriticalPathLatencyMs": 200,
    "maxDetectorLatencyMs": 150
  },
  "cases": [
    {
      "caseId": "mixed-cv-5fps-8ch",
      "sourceCaseId": "dual-cv-5fps-8ch",
      "workload": "concurrent-mixed",
      "targetFps": 5,
      "configuredChannels": 8,
      "outcome": "completed",
      "boundaryKind": "lower-bound",
      "lastPassingChannels": 8,
      "firstBlockedChannels": null,
      "blockedReason": null,
      "sourceSummarySha256": "1e05124dd6b6fbb5cb1d8a31e9ebff885dd8714168a4c44ae224e15d3f2676fc",
      "steps": [
        {
          "channels": 1,
          "holdSeconds": 30,
          "result": "PASS",
          "tasks": [
            {
              "name": "person-detector",
              "targetFps": 5,
              "minimumProcessingFps": 5.14,
              "minimumFpsRatio": 1.028,
              "missingRate": 0,
              "averageDiscardRate": 0,
              "maximumDetectorLatencyMs": 24.7,
              "maximumCriticalPathLatencyMs": 26.3
            },
            {
              "name": "no-safety-helmet-analysis",
              "targetFps": 5,
              "minimumProcessingFps": 5.1,
              "minimumFpsRatio": 1.021,
              "missingRate": 0,
              "averageDiscardRate": 0,
              "maximumDetectorLatencyMs": 24.7,
              "maximumCriticalPathLatencyMs": 53.2
            }
          ],
          "minimumProcessingFps": 5.1,
          "maximumDetectorLatencyMs": 24.7,
          "maximumCriticalPathLatencyMs": 53.2,
          "averageDiscardRate": 0,
          "maximumChannelDiscardRate": 0,
          "acceleratorPeakPercent": 8,
          "acceleratorMemoryPeakPercent": null,
          "cpuPeakPercent": 4,
          "memoryPeakPercent": 21,
          "failureReason": null
        },
        {
          "channels": 2,
          "holdSeconds": 30,
          "result": "PASS",
          "tasks": [
            {
              "name": "person-detector",
              "targetFps": 5,
              "minimumProcessingFps": 5.07,
              "minimumFpsRatio": 1.014,
              "missingRate": 0,
              "averageDiscardRate": 0,
              "maximumDetectorLatencyMs": 21.3,
              "maximumCriticalPathLatencyMs": 22.9
            },
            {
              "name": "no-safety-helmet-analysis",
              "targetFps": 5,
              "minimumProcessingFps": 5.05,
              "minimumFpsRatio": 1.01,
              "missingRate": 0,
              "averageDiscardRate": 0,
              "maximumDetectorLatencyMs": 21.3,
              "maximumCriticalPathLatencyMs": 44.4
            }
          ],
          "minimumProcessingFps": 5.05,
          "maximumDetectorLatencyMs": 21.3,
          "maximumCriticalPathLatencyMs": 44.4,
          "averageDiscardRate": 0,
          "maximumChannelDiscardRate": 0,
          "acceleratorPeakPercent": 14,
          "acceleratorMemoryPeakPercent": null,
          "cpuPeakPercent": 6,
          "memoryPeakPercent": 22,
          "failureReason": null
        },
        {
          "channels": 3,
          "holdSeconds": 30,
          "result": "PASS",
          "tasks": [
            {
              "name": "person-detector",
              "targetFps": 5,
              "minimumProcessingFps": 5.1,
              "minimumFpsRatio": 1.02,
              "missingRate": 0,
              "averageDiscardRate": 0,
              "maximumDetectorLatencyMs": 21.5,
              "maximumCriticalPathLatencyMs": 23.2
            },
            {
              "name": "no-safety-helmet-analysis",
              "targetFps": 5,
              "minimumProcessingFps": 5.08,
              "minimumFpsRatio": 1.017,
              "missingRate": 0,
              "averageDiscardRate": 0,
              "maximumDetectorLatencyMs": 21.5,
              "maximumCriticalPathLatencyMs": 48.3
            }
          ],
          "minimumProcessingFps": 5.08,
          "maximumDetectorLatencyMs": 21.5,
          "maximumCriticalPathLatencyMs": 48.3,
          "averageDiscardRate": 0,
          "maximumChannelDiscardRate": 0,
          "acceleratorPeakPercent": 20,
          "acceleratorMemoryPeakPercent": null,
          "cpuPeakPercent": 12,
          "memoryPeakPercent": 23,
          "failureReason": null
        },
        {
          "channels": 4,
          "holdSeconds": 30,
          "result": "PASS",
          "tasks": [
            {
              "name": "person-detector",
              "targetFps": 5,
              "minimumProcessingFps": 5.1,
              "minimumFpsRatio": 1.02,
              "missingRate": 0,
              "averageDiscardRate": 0,
              "maximumDetectorLatencyMs": 21.4,
              "maximumCriticalPathLatencyMs": 22.9
            },
            {
              "name": "no-safety-helmet-analysis",
              "targetFps": 5,
              "minimumProcessingFps": 5.07,
              "minimumFpsRatio": 1.014,
              "missingRate": 0,
              "averageDiscardRate": 0,
              "maximumDetectorLatencyMs": 21.4,
              "maximumCriticalPathLatencyMs": 44.3
            }
          ],
          "minimumProcessingFps": 5.07,
          "maximumDetectorLatencyMs": 21.4,
          "maximumCriticalPathLatencyMs": 44.3,
          "averageDiscardRate": 0,
          "maximumChannelDiscardRate": 0,
          "acceleratorPeakPercent": 26,
          "acceleratorMemoryPeakPercent": null,
          "cpuPeakPercent": 14,
          "memoryPeakPercent": 24,
          "failureReason": null
        },
        {
          "channels": 5,
          "holdSeconds": 30,
          "result": "PASS",
          "tasks": [
            {
              "name": "person-detector",
              "targetFps": 5,
              "minimumProcessingFps": 5.08,
              "minimumFpsRatio": 1.017,
              "missingRate": 0,
              "averageDiscardRate": 0,
              "maximumDetectorLatencyMs": 21.9,
              "maximumCriticalPathLatencyMs": 23.6
            },
            {
              "name": "no-safety-helmet-analysis",
              "targetFps": 5,
              "minimumProcessingFps": 5.07,
              "minimumFpsRatio": 1.014,
              "missingRate": 0,
              "averageDiscardRate": 0,
              "maximumDetectorLatencyMs": 21.9,
              "maximumCriticalPathLatencyMs": 42.6
            }
          ],
          "minimumProcessingFps": 5.07,
          "maximumDetectorLatencyMs": 21.9,
          "maximumCriticalPathLatencyMs": 42.6,
          "averageDiscardRate": 0,
          "maximumChannelDiscardRate": 0,
          "acceleratorPeakPercent": 31,
          "acceleratorMemoryPeakPercent": null,
          "cpuPeakPercent": 16,
          "memoryPeakPercent": 25,
          "failureReason": null
        },
        {
          "channels": 6,
          "holdSeconds": 30,
          "result": "PASS",
          "tasks": [
            {
              "name": "person-detector",
              "targetFps": 5,
              "minimumProcessingFps": 5.08,
              "minimumFpsRatio": 1.017,
              "missingRate": 0,
              "averageDiscardRate": 0,
              "maximumDetectorLatencyMs": 24.2,
              "maximumCriticalPathLatencyMs": 25.9
            },
            {
              "name": "no-safety-helmet-analysis",
              "targetFps": 5,
              "minimumProcessingFps": 5.04,
              "minimumFpsRatio": 1.007,
              "missingRate": 0,
              "averageDiscardRate": 0,
              "maximumDetectorLatencyMs": 24.2,
              "maximumCriticalPathLatencyMs": 43.8
            }
          ],
          "minimumProcessingFps": 5.04,
          "maximumDetectorLatencyMs": 24.2,
          "maximumCriticalPathLatencyMs": 43.8,
          "averageDiscardRate": 0,
          "maximumChannelDiscardRate": 0,
          "acceleratorPeakPercent": 35,
          "acceleratorMemoryPeakPercent": null,
          "cpuPeakPercent": 19,
          "memoryPeakPercent": 26,
          "failureReason": null
        },
        {
          "channels": 7,
          "holdSeconds": 30,
          "result": "PASS",
          "tasks": [
            {
              "name": "person-detector",
              "targetFps": 5,
              "minimumProcessingFps": 5.08,
              "minimumFpsRatio": 1.017,
              "missingRate": 0,
              "averageDiscardRate": 0,
              "maximumDetectorLatencyMs": 23.1,
              "maximumCriticalPathLatencyMs": 25
            },
            {
              "name": "no-safety-helmet-analysis",
              "targetFps": 5,
              "minimumProcessingFps": 5.05,
              "minimumFpsRatio": 1.01,
              "missingRate": 0,
              "averageDiscardRate": 0,
              "maximumDetectorLatencyMs": 23.1,
              "maximumCriticalPathLatencyMs": 44.7
            }
          ],
          "minimumProcessingFps": 5.05,
          "maximumDetectorLatencyMs": 23.1,
          "maximumCriticalPathLatencyMs": 44.7,
          "averageDiscardRate": 0,
          "maximumChannelDiscardRate": 0,
          "acceleratorPeakPercent": 37,
          "acceleratorMemoryPeakPercent": null,
          "cpuPeakPercent": 25,
          "memoryPeakPercent": 27,
          "failureReason": null
        },
        {
          "channels": 8,
          "holdSeconds": 30,
          "result": "PASS",
          "tasks": [
            {
              "name": "person-detector",
              "targetFps": 5,
              "minimumProcessingFps": 5.08,
              "minimumFpsRatio": 1.017,
              "missingRate": 0,
              "averageDiscardRate": 0,